wikipediatxt	NA	2017	144	0	El "potencial eléctrico" o "potencial electrostático" en un punto, es el trabajo que debe realizar un campo electrostático para mover una carga positiva "q" desde dicho punto hasta el punto de referencia, dividido por unidad de carga de prueba.	El "surf" es un deporte que consiste en deslizarse en una ola de pie sobre una tabla.
wikipediatxt	NA	2017	145	2.2	A cada una de las partículas de la naturaleza le corresponde una "antipartícula" que posee la misma masa, el mismo espín, pero distinta carga eléctrica.	De esta forma Feynman llegó a entender de forma gráfica el hecho de que la partícula y su antipartícula tuvieran la misma masa "m" y spin "J" pero cargas opuestas.
wikipediatxt	NA	2017	146	2.4	En sentido estricto, la democracia es una forma de organización del Estado en la cual las decisiones colectivas son adoptadas por el pueblo mediante mecanismos de participación directa o indirecta que confieren legitimidad a sus representantes.	"Democracia" es una forma de organización social que atribuye la titularidad del poder al conjunto de la sociedad.
wikipediatxt	NA	2017	147	3	Fue propuesto por Hugo Ball, escritor de los primeros textos dadaístas; posteriormente, se unió el rumano Tristan Tzara que llegaría a ser el emblema del Dadaísmo.	Posteriormente fue adoptado por Tristan Tzara, quien se convertiría en la figura más representativa del Dadaísmo.
wikipediatxt	NA	2017	148	3	La "robótica" es la rama de la tecnología que se dedica al diseño, construcción, operación, disposición estructural, manufactura y aplicación de los robots.	El término robótica es acuñado por Isaac Asimov, definiendo a la ciencia que estudia a los robots.
wikipediatxt	NA	2017	149	2	La Ciudad del Vaticano alberga la Santa Sede, máxima institución de la Iglesia católica.	La máxima autoridad del Vaticano y jefe de Estado del mismo es el sumo pontífice, por lo que puede considerarse la única teocracia de Europa.
wikipediatxt	NA	2017	150	1.2	El "Principado de Andorra" (en catalán: "Principat d'Andorra") es un pequeño principado soberano del suroeste de Europa con una extensión de 468 km 2, situado en los Pirineos entre España y Francia, con una altitud media de 1.996 metros sobre el nivel del mar.	La montaña más alta es el pico de Comapedrosa que, con una altitud de 2.942 msnm, está situado en la cordillera de los Pirineos, enclavado entre la frontera de España y Francia.
wikipediatxt	NA	2017	151	1.6	Se denomina "metal" a los elementos químicos caracterizados por ser buenos conductores del calor y la electricidad.	Mediante la teoría del «gas electrónico» podemos explicar por que los metales son tan buenos conductores del calor y la electricidad, pero es necesario comprender la naturaleza del enlace entre sus átomos.
wikipediatxt	NA	2017	152	3	Se denomina "veterinaria" (del latín "veterinae", bestia o animal de carga) a la ciencia médica de prevenir, diagnosticar y curar las enfermedades de los animales domésticos, animales silvestres y animales de producción.	La ciencia veterinaria ayuda a salvaguardar la salud humana mediante la vigilancia de la salud de los animales domésticos y de la fauna silvestre.
wikipediatxt	NA	2017	153	2.8	En Teoría de la Información se denomina "distancia de Hamming" a la efectividad de los códigos de bloque y depende de la diferencia entre una palabra de código válida y otra.	La distancia de Hamming se denomina así gracias a su inventor Richard Hamming, profesor de la Universidad de Nebraska, que fue el que introdujo el término para establecer una métrica capaz de establecer un "código para la detección y auto-corrección de códigos".
wikipediatxt	NA	2017	154	1.6	"La llamada de Cthulhu" es un juego de rol de horror ambientado en los años veinte y en particular en los «mitos de Cthulhu», universo de ficción iniciado por el escritor estadounidense Howard Phillips Lovecraft.	Otro juego de rol ambientado en los mitos de Cthulhu pero adaptado a un entorno de ciencia ficción es "CthulhuTech".
wikipediatxt	NA	2017	155	0.2	El tratamiento quirúrgico del cáncer de mama también se propone el tratamiento de los ganglios linfáticos 	axilares.
wikipediatxt	NA	2017	156	1.8	El "hiperrealismo" es una tendencia radical de la pintura realista surgida en Estados Unidos a finales de los años 60 del siglo XX que propone reproducir la realidad con más fidelidad y objetividad que la fotografía.	El término "hiperrealismo" es también aplicable a la escultura y la historieta (Luis García, Alex Ross, etc).
wikipediatxt	NA	2017	157	2	Los "Reyes Magos de Oriente" (o simplemente "Reyes Magos") es el nombre por el que la tradición denomina a los visitantes que, tras el nacimiento de Jesús de Nazaret, acudieron desde países extranjeros para rendirle homenaje y entregarle regalos de gran riqueza simbólica: oro, incienso y mirra.	C, «los Magos son de Oriente pero que en esa inquietud por buscar a Dios están representados los hombres buscadores de Dios de todos los lugares y de todos los tiempos».
wikipediatxt	NA	2017	158	1.6	El "Sol" (del latín "sol", "solis", a su vez de la raíz proto-indoeuropea "sauel-") Por sí solo, representa alrededor del 98,6 por ciento de la masa del Sistema Solar.	El Sol, junto con todos los cuerpos celestes que orbitan a su alrededor, incluida la Tierra, forman el Sistema Solar.
wikipediatxt	NA	2017	159	0	La crisis económica Argentina de fines del 2001 paraliza este desarrollo que recién se recupera con la expansión que se da en el área de la construcción casi tres años después.	La "prostitución" se define como el acto de participar en actividades sexuales o hacer el sexo a cambio de dinero o bienes.
wikipediatxt	NA	2017	160	1.4	El "Principado de Andorra" (nombre local, "Principat d'Andorra") es un estado de la Europa meridional, situado en la cordillera de los Pirineos orientales.	Es un estado sin litoral, en el que se encuentran importantes cruces de caminos de los Pirineos.
wikipediatxt	NA	2017	161	2.8	Las bacterias son procariotas y, por lo tanto, a diferencia de las células eucariotas (de animales, plantas, hongos, etc.), no tienen el núcleo definido ni presentan, en general, orgánulos membranosos internos.	Puesto que las bacterias son procariotas no tienen orgánulos citoplasmáticos delimitados por membranas y por ello presentan pocas estructuras intracelulares.
wikipediatxt	NA	2017	162	3.6	La banda sonora corrió a cargo de Wojciech Kilar, excepto el tema final "Canción de amor para un vampiro", que fue compuesto por Annie Lennox.	El tema principal de la película "Love Song for a Vampire" ("Canción de amor para un vampiro") fue escrita por Annie Lennox, que juntándola con el trabajo de Kilar, saldría al mercado un disco con la banda sonora y los temas interpretados por Lennox.
wikipediatxt	NA	2017	163	2.4	La "peseta" fue la unidad monetaria en España desde su aprobación el 19 de octubre de 1868 hasta el 1 de enero de 1999, cuando se introdujo el euro.	El 31 de diciembre de 1998, la peseta dejó de cotizar y fue sustituida por el euro.
wikipediatxt	NA	2017	164	3	La peseta siguió circulando hasta el 31 de diciembre de 2001 con la consideración legal de «fracción no decimal de euro» y después, provisionalmente, hasta el 28 de febrero de 2002.	Las pesetas siguieron en circulación hasta el 28 de febrero de 2002, con la entrada del euro, tras 133 años de vigencia.
wikipediatxt	NA	2017	165	0.4	El "Proterozoico", una división de la escala temporal geológica, es un eón geológico perteneciente al Precámbrico que abarca desde hace 2.500 millones de años hasta hace 542 millones de años, durando 1958 millones de años,0 ± 1,0 millones de años.	Es la rama de la lingüística que estudia la producción y percepción de los sonidos de una lengua con respecto a sus manifestaciones "físicas".
wikipediatxt	NA	2017	166	3.6	En condiciones normales de presión y temperatura, dos átomos del elemento se enlazan para formar el dioxígeno, un gas diatómico incoloro, inodoro e insípido con fórmula O 2.	En condiciones normales de presión y temperatura, el oxígeno es un gas incoloro e inodoro con fórmula molecular O 2, en el que dos átomos de oxígeno se enlazan con una configuración electrónica en estado triplete.
wikipediatxt	NA	2017	167	0.6	Habermas es el miembro más eminente de la segunda generación de la Escuela de Frankfurt y uno de los exponentes de la Teoría crítica desarrollada en el Instituto de Investigación Social.	Se apoya en la idea de una completa transformación de la crítica del conocimiento en crítica de la sociedad.
wikipediatxt	NA	2017	168	0	El "ciclismo" es un deporte que implica el uso de la bicicleta para recorrer circuitos al aire libre, en pista cubierta, o que engloba diferentes especialidades como las que se menciona abajo.	El "sarampión" es una enfermedad infecciosa exantemática como la rubéola y la varicela, bastante frecuente, especialmente en niños causada por un virus, específicamente un paramixovirus del género "Morbillivirus".
wikipediatxt	NA	2017	169	0	El "diseño visual" o "diseño en comunicación visual" es una disciplina profesional que estudia los sistemas de información, con el objeto de convertir los datos en formas visuales, teniendo en cuenta los procesos perceptivos.	La "Antártida" o "continente antártico", es el continente sobre el cual se encuentra el Polo Sur.
wikipediatxt	NA	2017	170	0	Durante buena parte del siglo XX (principalmente la primera mitad) tuvo lugar un período de gran crecimiento económico en el marco de una política dominada por un solo partido político.	La mayor parte de la red de ferrocarriles sirve en la actualidad para el transporte de mercancías.
wikipediatxt	NA	2017	171	3.6	El "lenguaje de consulta estructurado" o "SQL" (por sus siglas en inglés "structured query language") es un lenguaje declarativo de acceso a bases de datos relacionales que permite especificar diversos tipos de operaciones en ellas.	El SQL es un lenguaje de acceso a bases de datos que explota la flexibilidad y potencia de los sistemas relacionales y permite así gran variedad de operaciones.
wikipediatxt	NA	2017	172	0.6	En la década de 1980, la escolarización universal y la industrialización permitieron al país desarrollar una exitosa industria manufacturera.	La gran mayoría de sus habitantes nacidos después de la Segunda Guerra Mundial entienden y hablan el inglés gracias a los vínculos comerciales, la popularidad de los viajes al extranjero y una fuerte influencia anglo-estadounidense.
wikipediatxt	NA	2017	173	0.4	La "historia del cristianismo" se refiere a la religión cristiana, sus seguidores y de la Iglesia, con sus diferentes denominaciones, desde el siglo I hasta la actualidad.	La política romana era tolerante a la religión y las costumbres de los pueblos conquistados.
wikipediatxt	NA	2017	174	2.6	"Argentina", oficialmente "República Argentina", es un país de América, organizado como república representativa y federal, situado en el extremo sureste y sur de América del Sur.	La Argentina es el país más visitado de América del Sur y el cuarto más visitado del continente americano.
wikipediatxt	NA	2017	175	2.4	"Joaquín Ramón Martínez Sabina" (Úbeda, Jaén, 12 de febrero de 1949), conocido artísticamente como "Joaquín Sabina", es un cantautor y poeta español de éxito en países de habla hispana.	Joaquín Sabina nace el 12 de febrero de 1949 en la localidad de Úbeda (Jaén, España), segundo hijo de Adela Sabina del Campo, ama de casa y de Jerónimo Martínez Gallego, inspector de policía. que se dedicaban sobre todo a versionar a cantantes de rock como Elvis Presley, Chuck Berry o Little Richard.
wikipediatxt	NA	2017	176	1.8	El "reggae" es un género musical que se desarrolló por primera vez en Jamaica hacia mediados de los años 1960.	El Rap es un estilo de cantar o hablar sobre un disco instrumental que fue utilizado por primera vez en Jamaica en 1960, donde se le conocía como Toasting, por deejays como U-Roy y Dennis Alcapone.
wikipediatxt	NA	2017	177	0.4	El fin de este arte es suscitar una experiencia estética en el oyente, y expresar sentimientos, circunstancias, pensamientos o ideas.	La mayoría de los estudiosos coincide en el aspecto de la estructura, es decir, en el hecho de que la música implica una organización; pero algunos teóricos modernos difieren en que el resultado deba ser placentero o agradable.
wikipediatxt	NA	2017	178	2.6	En el siglo VII, los musulmanes habían comenzado una rápida expansión en la que ocuparon Oriente Medio y el norte de África, llegando a la Península Ibérica a principios del siglo siguiente, en el marco del último proceso expansionista del Califato Omeya de Damasco.	Hacia el 718 la Península Ibérica, salvo las zonas montañosas del norte habitadas por Vascones, Cántabros y Astures, estaba en manos del Califato Omeya.
wikipediatxt	NA	2017	179	3	El "Derecho procesal civil" es una rama del Derecho procesal que regula la actuación ante los Tribunales para obtener la tutela de los derechos en asuntos de naturaleza civil o mercantil.	El derecho procesal civil es el conjunto de normas jurídicas adjetivas de orden público que regulan los trámites necesarios para la aplicación de las instituciones sustantivas previstas en la legislación civil de un Estado.
wikipediatxt	NA	2017	180	2	El "modelo estándar" de la física de partículas es una teoría que describe las relaciones entre las interacciones fundamentales conocidas y las partículas elementales que componen toda la materia.	Dentro de esto, el modelo estándar agrupa dos teorías importantes - el modelo electrodébil y la cromodinámica cuántica- lo que proporciona una teoría internamente consistente que describe las interacciones entre todas las partículas observadas experimentalmente.
wikipediatxt	NA	2017	181	1.2	Obtuvo el premio Nobel de Medicina en 1906 por descubrir los mecanismos que gobiernan la morfología y los procesos conectivos de las células nerviosas, una nueva y revolucionaria teoría que empezó a ser llamada la «"doctrina de la neurona"», basada en que el tejido cerebral está compuesto por células individuales.	Fue en 1888, definido por el propio Ramón y Cajal como su "año cumbre", cuando descubrió los mecanismos que gobiernan la morfología y los procesos conectivos de las células nerviosas de la materia gris del sistema nervioso cerebroespinal.
wikipediatxt	NA	2017	182	2.6	La masa del neutrino tiene importantes consecuencias en el modelo estándar de física de partículas, ya que implicaría la posibilidad de transformaciones entre los tres tipos de neutrinos existentes en un fenómeno conocido como oscilación de neutrinos.	Los neutrinos pueden pasar de una familia a otra (es decir, cambiar de sabor) en un proceso conocido como oscilación de neutrinos.
wikipediatxt	NA	2017	183	3.4	Una "máquina de Turing" es un dispositivo que manipula símbolos sobre una tira de cinta de acuerdo a una tabla de reglas.	Una máquina de Turing es un modelo computacional que realiza una lectura/escritura de manera automática sobre una entrada llamada cinta, generando una salida en esta misma.
wikipediatxt	NA	2017	184	0	La Ciudad del Vaticano alberga la Santa Sede, máxima institución de la Iglesia católica.	La autora del libro comenta que la gastronomía de este país es «una de las más complejas y ricas del mundo, mucho más que la de cualquier Casa Real».
wikipediatxt	NA	2017	185	1.2	La familia, cuyo nombre deriva del género Iris, cuenta con más de 2.000 especies que se distribuyen por casi todo el mundo, siendo una de las familias más importantes en horticultura.	La familia comprende aproximadamente 70 géneros y más de 1600 especies, distribuidas por todo el globo, con una marcada concentración de especies en el Hemisferio Sur y el mayor centro de radiación en África, al sur del Sahara.
wikipediatxt	NA	2017	186	1.6	Por otra parte la ictiología además se ocupa de la biología y comportamiento de los peces.	La obra "Regne animal distribué d'après son organisation" de Georges Cuvier, publicada entre 1817-1830 fue un paso clave para la clasificación de los peces.
wikipediatxt	NA	2017	187	0.8	El "Sistema Solar" es un sistema planetario en el que se encuentra la Tierra.	El gas interplanetario es un tenue flujo de gas y partículas cargadas que forman un plasma que es expulsado por el Sol en el viento solar.
wikipediatxt	NA	2017	188	0	El "himno nacional" es, en la mayoría de los casos, una composición musical patriótica aceptada por el gobierno de un país como la música oficial del Estado.	Durante los diecisiete años que pasaron en Hartford y los veinte en Quarry Farm, Twain escribió muchas de sus novelas clásicas, como "Las aventuras de Tom Sawyer" (1876), "El príncipe y el mendigo" (1881), "Vida en el Misisipi" (1883), "Las aventuras de Huckleberry Finn" (1885) y "Un yanqui en la corte del Rey Arturo" (1889).
wikipediatxt	NA	2017	189	1.4	El cáncer es una enfermedad genética producida por la mutación en unos genes determinados.	Estas mutaciones deben provocar alguna alteración en la secuencia de protooncogenes y genes supresores de tumores, los cuales son los encargados de regular el ciclo celular y la muerte celular programada (apoptosis).
wikipediatxt	NA	2017	190	2	En informática, un "disco duro" o "disco rígido" (en inglés "Hard Disk Drive", HDD) es un dispositivo de almacenamiento de datos no volátil que emplea un sistema de grabación magnética para almacenar datos digitales.	Una "unidad de estado sólido " o "SSD" (acrónimo en inglés de "solid-state drive") es un dispositivo de almacenamiento de datos que puede estar construido con memoria no volátil o con memoria volátil.
wikipediatxt	NA	2017	191	3.2	La "teoría de la relatividad" está compuesta a grandes rasgos por dos grandes teorías (la de la relatividad especial y la de la relatividad general) formuladas por Albert Einstein a principios del siglo XX, que pretendían resolver la incompatibilidad existente entre la mecánica newtoniana y el electromagnetismo.	La teoría de la relatividad especial, también llamada teoría de la relatividad restringida, fue publicada por Albert Einstein en 1905 y describe la física del movimiento en el marco de un espacio-tiempo plano.
wikipediatxt	NA	2017	192	3	Quizá su faceta menos conocida es su proyecto (en 1935) de un motor a reacción (denominado "Mototurbocompresor de Reacción Continua") que el inicio de la Guerra Civil le impidió comenzar.	Durante el tiempo que estuvo en prisión diseñó un motor a reacción, original y revolucionario para su época, al que denominó Mototurbocompresor de Reacción Continua.
wikipediatxt	NA	2017	193	3.6	Entre otros descubrimientos formuló la ecuación de Dirac que describe el comportamiento de los fermiones y con la cual predijo la existencia de la antimateria.	Dirac fundó la teoría cuántica de campos con su interpretación de la ecuación de Dirac como una ecuación de muchos cuerpos, con la cual predijo la existencia de la antimateria así como los procesos de aniquilación de materia y antimateria.
wikipediatxt	NA	2017	194	2	Generalmente el karma se interpreta como una «ley» cósmica de retribución, o de causa y efecto.	En cambio, según Yogananda, no habría ministros para ejecutar la ley del karma, sino que ésta se ejecutaría a sí misma como ley cósmica, astral o espiritual de forma automática.
wikipediatxt	NA	2017	195	1.6	La "Real Colegiata Basílica de San Isidoro" o, simplemente, "San Isidoro de León", es un templo cristiano ubicado en la ciudad de León, en España.	El gallo-veleta de la torre de San Isidoro fue durante siglos el símbolo más preciado de la ciudad de León.
wikipediatxt	NA	2017	196	0.8	Posteriormente, durante cerca de un siglo el país se vio envuelto en una serie de guerras internas e invasiones extranjeras que tuvieron repercusiones en todos los ámbitos de la vida de los mexicanos.	El español es la lengua dominante en asuntos oficiales y es el idioma materno de la mayoría de los mexicanos.
wikipediatxt	NA	2017	197	3.2	El código ASCII utiliza 7 bits para representar los carácteres, aunque inicialmente empleaba un bit adicional (bit de paridad) que se usaba para detectar errores en la transmisión.	En el momento en el que se introdujo el código ASCII muchos ordenadores trabajaban con grupos de ocho bits (bytes u octetos), como la unidad mínima de información; donde el octavo bit se usaba habitualmente como bit de paridad con funciones de control de errores en líneas de comunicación u otras funciones específicas del dispositivo.
wikipediatxt	NA	2017	198	1.2	La neuroanatomía es el estudio de la estructura y la organización del sistema nervioso.	El primer registro escrito conocido de un estudio de la anatomía del cerebro humano es egipcio, el papiro de Edwin Smith.
wikipediatxt	NA	2017	199	2.2	"El Señor de los Anillos" (título original en inglés: "The Lord of the Rings") es una novela de fantasía épica escrita por el filólogo y escritor británico J. R. R. Tolkien.	J. R. R. Tolkien planeó "El Señor de los Anillos" como una secuela de su anterior novela, "El hobbit", pero terminó por convertirse en una historia de mucho más alcance y extensión que, escrita por etapas entre 1937 y 1949, se publicó por primera vez en el Reino Unido entre 1954 y 1955 en tres volúmenes.
wikipediatxt	NA	2017	200	1.2	No se conserva ningún fragmento suyo y es probable que no dejara ningún escrito a su muerte.	La filosofía de Tales de Mileto, no se conoce de primera mano, pues no ha sobrevivido ningún escrito de Tales (de hecho, ni siquiera es seguro que haya escrito algo).
wikipediatxt	NA	2017	201	0	Aunque el culombio es una unidad derivada del Sistema Internacional, en las baterías eléctricas es muy frecuente utilizar la unidad AH (Amperio-hora), que refleja la cantidad de carga total que puede acumular la batería.	El peso equivale a la fuerza que ejerce un cuerpo sobre un punto de apoyo, originada por la acción del campo gravitatorio local sobre la masa del cuerpo.
wikipediatxt	NA	2017	202	2.4	La expresión "electrónica de potencia" se utiliza para diferenciar el tipo de aplicación que se le da a dispositivos electrónicos, en este caso para transformar y controlar voltajes y corrientes de niveles significativos.	En este tipo de aplicación se reencuentran la electricidad y la electrónica, pues se utiliza el control que permiten los circuitos electrónicos para controlar la conducción (encendido y apagado) de semiconductores de potencia para el manejo de corrientes y voltajes en aplicaciones de potencia.
wikipediatxt	NA	2017	203	2	Está situado en el corazón de la ciudad, en una colina situada entre los ríos Bernesga y Torío, cuya posición elevada entre dos fuentes de agua continuas decidió la creación del campamento de la Legio VI Victrix, origen de la ciudad.	El casco antiguo de León se ubica en el centro de la ciudad y sobre una colina desde la que se domina gran parte del espacio comprendido entre los ríos Bernesga y Torío.
wikipediatxt	NA	2017	204	3.6	En un átomo, el número de protones en el núcleo determina las propiedades químicas del átomo y qué elemento químico es.	En química, el número de protones en el núcleo de un átomo se conoce como número atómico ( Z ), y determina el elemento químico al que pertenece el átomo.
wikipediatxt	NA	2017	205	3	"Blade Runner" es una película de ciencia ficción estadounidense, dirigida por Ridley Scott, estrenada en 1982 y basada parcialmente en la novela de Philip K. Dick "¿Sueñan los androides con ovejas eléctricas?" (1968).	Michael Green trabaja en el guión de la secuela de "Blade Runner" sobre una historia escrita por Hampton Fancher, guionista de la película original basada en la novela de Philip K. Dick "¿Sueñan los androides con ovejas eléctricas?".
wikipediatxt	NA	2017	206	3.4	Generalmente el karma se interpreta como una «ley» cósmica de retribución, o de causa y efecto.	Según los hindúes, el karma es una «ley» de acción y reacción: a cada acción cometida le corresponde una reacción igual y opuesta.
wikipediatxt	NA	2017	207	2.8	El tratamiento del cáncer de la mama es multidisciplinario, es decir precisa la combinación de diversas modalidades o disciplinas terapéuticas para conseguir un control eficaz de la enfermedad.	Las modalidades terapéuticas contra el cáncer de mama son la cirugía, la radioterapia, la quimioterapia, la hormonoterapia y la terapia biomolecular.
wikipediatxt	NA	2017	208	3.4	A esta diferencia se le llama distancia de Hamming, y se define como el número de bits que tienen que cambiarse para transformar una palabra de código válida en otra palabra de código válida.	La distancia de Hamming se denomina así gracias a su inventor Richard Hamming, profesor de la Universidad de Nebraska, que fue el que introdujo el término para establecer una métrica capaz de establecer un "código para la detección y auto-corrección de códigos".
wikipediatxt	NA	2017	209	2.4	La "quiromancia" o "quiromancía" es el intento de la adivinación a través de la lectura de las líneas de la mano.	Se suele decir que en las manos se puede conocer el destino de una persona y adivinar sucesos pasados, presentes y futuros.
wikipediatxt	NA	2017	210	3	"JPEG" (del inglés "Joint Photographic Experts Group", Grupo Conjunto de Expertos en Fotografía) es el nombre de un comité de expertos que creó un estándar de compresión y codificación de archivos e imágenes fijas.	El formato JPEG utiliza habitualmente un algoritmo de compresión con pérdida para reducir el tamaño de los archivos de imágenes.
